{
  "schemaVersion": 1,
  "classification": "governed-provisional",
  "version": "v1",
  "approvalState": "provisional",
  "publicationStatus": "nonpublishable",
  "sourceManifest": "packages/atlas/generated/manifest.json",
  "reason": "The owner-selected left Continuous Lens Aperture v2 remains governed-provisional pending numerical geometry, provenance, accessibility, and production evidence; every current Atlas vector depends on that nonpublishable working master.",
  "promotionRequires": [
    "explicit-master-approval",
    "geometry-and-provenance-verification",
    "dependent-asset-regeneration",
    "publishable-boundary-review"
  ],
  "assets": [
    {
      "path": "packages/atlas/generated/atlas-bands.svg",
      "sha256": "2269e44629952e807128e10167bb8defffcd5c007c98ef9c851e4a46a37a0303",
      "approved": false,
      "mediaType": "image/svg+xml",
      "kind": "atlas",
      "approvalState": "provisional",
      "viewBox": "0 0 1600 900",
      "sourceProvenance": "packages/atlas/generated/manifest.json",
      "relationship": "derivative",
      "master": "packages/atlas/generated/calibrated-aperture.svg",
      "generator": {
        "name": "bizarre-atlas-single-mass",
        "version": "1.0.0",
        "configurationHash": "8105397925fa8ceaaeb8c3f5a7d54a5aa986add138bb8887e1a179d924b99670"
      },
      "provenance": {
        "sourceType": "synthetic",
        "sourceIdentifier": "synthetic:bizarre-atlas-single-mass@1.0.0:18d2969f11e6232802a6ee6d4a16b4576f781d4bed10973ec385c735e4aac676",
        "model": {
          "name": "single-mass-lensing-field",
          "version": "1.0.0"
        },
        "apertureVersion": "continuous-lens-aperture/owner-selected-left-v2",
        "aperturePathSha256": "bb4079e12e6db7bb2387dc7fbe174b3283b57d5af4d4e942e4053bd96158c9dd"
      },
      "authorityStatus": "governed-provisional",
      "verificationStatus": "NOT VERIFIED",
      "publicationStatus": "nonpublishable",
      "publishable": false,
      "intendedUses": [
        "data-visualization",
        "editorial",
        "interface"
      ]
    },
    {
      "path": "packages/atlas/generated/atlas-contours-dark.svg",
      "sha256": "b4694f25d640a0c4a0e849898eab392eaa3e2cafcbd4924e6082e184d229307c",
      "approved": false,
      "mediaType": "image/svg+xml",
      "kind": "atlas",
      "approvalState": "provisional",
      "viewBox": "0 0 1600 900",
      "sourceProvenance": "packages/atlas/generated/manifest.json",
      "relationship": "derivative",
      "master": "packages/atlas/generated/calibrated-aperture.svg",
      "generator": {
        "name": "bizarre-atlas-single-mass",
        "version": "1.0.0",
        "configurationHash": "2c50ea20e1161abc9b830754cca3e4c0af70fdd87f80a2414264df2b744723f1"
      },
      "provenance": {
        "sourceType": "synthetic",
        "sourceIdentifier": "synthetic:bizarre-atlas-single-mass@1.0.0:18d2969f11e6232802a6ee6d4a16b4576f781d4bed10973ec385c735e4aac676",
        "model": {
          "name": "single-mass-lensing-field",
          "version": "1.0.0"
        },
        "apertureVersion": "continuous-lens-aperture/owner-selected-left-v2",
        "aperturePathSha256": "bb4079e12e6db7bb2387dc7fbe174b3283b57d5af4d4e942e4053bd96158c9dd"
      },
      "authorityStatus": "governed-provisional",
      "verificationStatus": "NOT VERIFIED",
      "publicationStatus": "nonpublishable",
      "publishable": false,
      "intendedUses": [
        "data-visualization",
        "editorial",
        "interface"
      ]
    },
    {
      "path": "packages/atlas/generated/atlas-contours-large.svg",
      "sha256": "a9b98e58ebdbc8afb0c42a1d7946cf681a8a5fa96a29e94dcd13face5f647e97",
      "approved": false,
      "mediaType": "image/svg+xml",
      "kind": "atlas",
      "approvalState": "provisional",
      "viewBox": "0 0 620 349",
      "sourceProvenance": "packages/atlas/generated/manifest.json",
      "relationship": "derivative",
      "master": "packages/atlas/generated/calibrated-aperture.svg",
      "generator": {
        "name": "bizarre-atlas-single-mass",
        "version": "1.0.0",
        "configurationHash": "2ba547b43dc2976a7ff4c3a1be98e1270f4cbe7a6ff21c1d2c7dbc95167aa09f"
      },
      "provenance": {
        "sourceType": "synthetic",
        "sourceIdentifier": "synthetic:bizarre-atlas-single-mass@1.0.0:7e35c8cc2641acbb4bbf2afcb7b215af94544d8d6bdae3d55180cfd289838338",
        "model": {
          "name": "single-mass-lensing-field",
          "version": "1.0.0"
        },
        "apertureVersion": "continuous-lens-aperture/owner-selected-left-v2",
        "aperturePathSha256": "bb4079e12e6db7bb2387dc7fbe174b3283b57d5af4d4e942e4053bd96158c9dd"
      },
      "authorityStatus": "governed-provisional",
      "verificationStatus": "NOT VERIFIED",
      "publicationStatus": "nonpublishable",
      "publishable": false,
      "intendedUses": [
        "data-visualization",
        "editorial",
        "interface"
      ]
    },
    {
      "path": "packages/atlas/generated/atlas-contours-light.svg",
      "sha256": "e91f34eb1101ca7f89c75cc9b5181549022436fb7e06b05f9e1ed63fe009f69a",
      "approved": false,
      "mediaType": "image/svg+xml",
      "kind": "atlas",
      "approvalState": "provisional",
      "viewBox": "0 0 1600 900",
      "sourceProvenance": "packages/atlas/generated/manifest.json",
      "relationship": "derivative",
      "master": "packages/atlas/generated/calibrated-aperture.svg",
      "generator": {
        "name": "bizarre-atlas-single-mass",
        "version": "1.0.0",
        "configurationHash": "fd866f82dd84b52f986d48c48bea27bea84fdaacd5793f120eac4e42257fb86f"
      },
      "provenance": {
        "sourceType": "synthetic",
        "sourceIdentifier": "synthetic:bizarre-atlas-single-mass@1.0.0:18d2969f11e6232802a6ee6d4a16b4576f781d4bed10973ec385c735e4aac676",
        "model": {
          "name": "single-mass-lensing-field",
          "version": "1.0.0"
        },
        "apertureVersion": "continuous-lens-aperture/owner-selected-left-v2",
        "aperturePathSha256": "bb4079e12e6db7bb2387dc7fbe174b3283b57d5af4d4e942e4053bd96158c9dd"
      },
      "authorityStatus": "governed-provisional",
      "verificationStatus": "NOT VERIFIED",
      "publicationStatus": "nonpublishable",
      "publishable": false,
      "intendedUses": [
        "data-visualization",
        "editorial",
        "interface"
      ]
    },
    {
      "path": "packages/atlas/generated/atlas-dots-large.svg",
      "sha256": "861f47486671516e8a0ce5f5c5dcebae1308777a1fcd4cffdfe7967053ee500f",
      "approved": false,
      "mediaType": "image/svg+xml",
      "kind": "texture",
      "approvalState": "provisional",
      "viewBox": "0 0 620 349",
      "sourceProvenance": "packages/atlas/generated/manifest.json",
      "relationship": "derivative",
      "master": "packages/atlas/generated/calibrated-aperture.svg",
      "generator": {
        "name": "bizarre-atlas-single-mass",
        "version": "1.0.0",
        "configurationHash": "ef232ddb9884aa5ee2ecd8f691328a5c966f69f777f8882a64c9472ff66201b5"
      },
      "provenance": {
        "sourceType": "synthetic",
        "sourceIdentifier": "synthetic:bizarre-atlas-single-mass@1.0.0:7e35c8cc2641acbb4bbf2afcb7b215af94544d8d6bdae3d55180cfd289838338",
        "model": {
          "name": "single-mass-lensing-field",
          "version": "1.0.0"
        },
        "apertureVersion": "continuous-lens-aperture/owner-selected-left-v2",
        "aperturePathSha256": "bb4079e12e6db7bb2387dc7fbe174b3283b57d5af4d4e942e4053bd96158c9dd"
      },
      "authorityStatus": "governed-provisional",
      "verificationStatus": "NOT VERIFIED",
      "publicationStatus": "nonpublishable",
      "publishable": false,
      "intendedUses": [
        "data-visualization",
        "editorial",
        "interface"
      ]
    },
    {
      "path": "packages/atlas/generated/atlas-dots.svg",
      "sha256": "2c9f4c0d2b134cbf25f151e79fc28b68a3f361df96518d59c0c8295e5d61fad0",
      "approved": false,
      "mediaType": "image/svg+xml",
      "kind": "texture",
      "approvalState": "provisional",
      "viewBox": "0 0 1600 900",
      "sourceProvenance": "packages/atlas/generated/manifest.json",
      "relationship": "derivative",
      "master": "packages/atlas/generated/calibrated-aperture.svg",
      "generator": {
        "name": "bizarre-atlas-single-mass",
        "version": "1.0.0",
        "configurationHash": "2e5bfb31678771673a9ede8791f605ab21fba833de406e48d0db69f64dfbd79d"
      },
      "provenance": {
        "sourceType": "synthetic",
        "sourceIdentifier": "synthetic:bizarre-atlas-single-mass@1.0.0:18d2969f11e6232802a6ee6d4a16b4576f781d4bed10973ec385c735e4aac676",
        "model": {
          "name": "single-mass-lensing-field",
          "version": "1.0.0"
        },
        "apertureVersion": "continuous-lens-aperture/owner-selected-left-v2",
        "aperturePathSha256": "bb4079e12e6db7bb2387dc7fbe174b3283b57d5af4d4e942e4053bd96158c9dd"
      },
      "authorityStatus": "governed-provisional",
      "verificationStatus": "NOT VERIFIED",
      "publicationStatus": "nonpublishable",
      "publishable": false,
      "intendedUses": [
        "data-visualization",
        "editorial",
        "interface"
      ]
    },
    {
      "path": "packages/atlas/generated/atlas-hatch-large.svg",
      "sha256": "03358c5c00f03b76004d782ddbcad688e5a259ae6dff1147138ab4b0fe2a2ec9",
      "approved": false,
      "mediaType": "image/svg+xml",
      "kind": "texture",
      "approvalState": "provisional",
      "viewBox": "0 0 620 349",
      "sourceProvenance": "packages/atlas/generated/manifest.json",
      "relationship": "derivative",
      "master": "packages/atlas/generated/calibrated-aperture.svg",
      "generator": {
        "name": "bizarre-atlas-single-mass",
        "version": "1.0.0",
        "configurationHash": "24ed1f9f4c6557dd8a2020f9a83c62cfd65858dc2fc6405f4bd492d8d5456a54"
      },